{
  "$schema": "https://json-schema.org/draft/2020-12/schema",
  "$id": "artifact.schema.json",
  "title": "Artifact Contract Registry Entry",
  "type": "object",
  "required": [
    "type",
    "version",
    "description",
    "pathPattern",
    "status",
    "allowedStatuses",
    "requiredHeadings"
  ],
  "additionalProperties": false,
  "properties": {
    "type": {
      "type": "string",
      "minLength": 1
    },
    "version": {
      "type": "string",
      "pattern": "^\\d+\\.\\d+\\.\\d+$"
    },
    "description": {
      "type": "string",
      "minLength": 1
    },
    "pathPattern": {
      "type": "string",
      "minLength": 1,
      "pattern": "^(?!/)(?!.*(?:^|/)\\.\\.(?:/|$)).+"
    },
    "status": {
      "type": "object",
      "required": [
        "heading",
        "pattern"
      ],
      "additionalProperties": false,
      "properties": {
        "heading": {
          "type": "string",
          "const": "## Status"
        },
        "pattern": {
          "type": "string",
          "minLength": 1
        }
      }
    },
    "allowedStatuses": {
      "type": "array",
      "minItems": 1,
      "items": {
        "type": "string",
        "minLength": 1
      },
      "uniqueItems": true
    },
    "requiredHeadings": {
      "type": "array",
      "minItems": 1,
      "items": {
        "type": "string",
        "minLength": 1
      },
      "uniqueItems": true
    }
  }
}
