{
  "type": "CodeReview",
  "version": "0.2.0",
  "description": "Artifact contract for code review gate output.",
  "pathPattern": "agent-output/code-review/*.md",
  "status": {
    "heading": "## Status",
    "pattern": "PASS|FAIL|BLOCKED"
  },
  "allowedStatuses": [
    "PASS",
    "FAIL",
    "BLOCKED"
  ],
  "requiredHeadings": [
    "# Code Review",
    "## Status",
    "## Summary",
    "## Evidence Reviewed",
    "## Findings",
    "## Required Fixes",
    "## Handoff Target"
  ]
}
